{
  "schema_version": "release-observation/v0",
  "release_id": "demo-release@4.0.0",
  "source_tree_digest": "0000000000000000000000000000000000000005",
  "source_ref": {
    "repo": "demo-org/demo-release",
    "ref": "v4.0.0",
    "resolution": "git_tree"
  },
  "artifact_digest": "sha256:0000000000000000000000000000000000000000000000000000000000000000",
  "artifact_ref": {
    "registry": "other",
    "package": "demo-release",
    "version": "4.0.0",
    "verifiability": "unverifiable",
    "unverifiable_reason": "Synthetic fixture: this release form is published to a private, non-public registry with no reachable metadata or artifact endpoint for CI (or anyone outside the org) to check against."
  },
  "environment": "production",
  "deployed_at": "2026-08-14T00:00:00Z",
  "verification_status": "not_measured",
  "quality_status": "not_measured"
}
