{
  "schema_version": "release-observation/v0",
  "release_id": "evidence-docs@0.1.0",
  "source_tree_digest": "dc6279d19540715be2076e1c6968c8b51673fb93",
  "source_ref": {
    "repo": "shiki-yusuke/evidence-docs",
    "ref": "v0.1.0",
    "resolution": "git_tree"
  },
  "artifact_digest": "sha256:b4b59b281883b5b484280e7aeb6bbd96c220539ed8ec0d8cf43d1d5303e3de16",
  "artifact_ref": {
    "registry": "pypi",
    "package": "evidence-docs",
    "version": "0.1.0",
    "distribution": "evidence_docs-0.1.0-py3-none-any.whl",
    "verifiability": "registry_metadata"
  },
  "environment": "production",
  "deployed_at": "2026-08-14T21:57:50.219235Z",
  "verification_status": "verified",
  "quality_status": "not_measured"
}
